{
  "source_url": "https://m.mobile.de/auto-inserat/renault-kadjar-t%C3%BCv-inspektion-neu-scheckheftgepflegt-m%C3%B6nchengladbach/459570928.html?ref=seo&refId=91653578-3c85-8e20-fd35-9fd76eebfc30&searchId=91653578-3c85-8e20-fd35-9fd76eebfc30&type=ad",
  "source_id": "459570928",
  "make": "Renault",
  "model": "Kadjar",
  "variant": "Experience",
  "generated_at": "2026-07-05T09:08:04+00:00",
  "_meta": {
    "text_by": "op-translator-copy (Gael)",
    "price_by": "op-pricer (Max)"
  },
  "content": {
    "title_it": "Renault Kadjar Experience",
    "headline_it": "2015 · 74.000 km · Benzina",
    "description_it": "Renault Kadjar Experience in ottime condizioni, disponibile presso la nostra concessionaria. Vettura immatricolata nel 2015, con 74.000 km, alimentazione benzina, cambio manuale, potenza di 131 CV. Tra le dotazioni: Abgedunkelte Vetri, ABS, Pneumatici quattro stagioni, Bracciolo, Assistente partenza in salita, Bluetooth, Computer di bordo e CD-Spieler. Possibilità di permuta e finanziamento. Contattaci per una prova o maggiori informazioni.",
    "highlights_it": [
      "Immatricolata 2015",
      "74.000 km",
      "Cambio manuale",
      "Alimentazione benzina",
      "131 CV",
      "Barre sul tetto"
    ],
    "equipment_it": [
      "Abgedunkelte Vetri",
      "ABS",
      "Pneumatici quattro stagioni",
      "Bracciolo",
      "Assistente partenza in salita",
      "Bluetooth",
      "Computer di bordo",
      "CD-Spieler",
      "Barre sul tetto",
      "Alzacristalli elettrici",
      "Specchietti laterali elettrici",
      "Immobilizzatore elettronico",
      "ESP",
      "Vivavoce",
      "Trazione anteriore",
      "Garanzia",
      "Limitatore di velocità",
      "Specchietto interno autoschermante",
      "Ispezione nuova",
      "Attacchi Isofix",
      "Volante in pelle",
      "Luci diurne LED",
      "Cerchi in lega",
      "Sensore luci",
      "Supporto lombare",
      "Volante multifunzione",
      "Predisposizione navigatore",
      "Fendinebbia",
      "Veicolo non fumatori",
      "Assistente frenata di emergenza",
      "Sistema di chiamata d'emergenza",
      "Controllo pressione pneumatici",
      "Reserverad",
      "Tagliandi regolari certificati",
      "chiusura centralizzata senza chiave (Keyless)",
      "Servosterzo",
      "Impianto audio premium",
      "Pacchetto sportivo",
      "Comandi vocali",
      "Sistema start&stop",
      "Cruise control",
      "Controllo di trazione",
      "Tuner/Radio",
      "USB",
      "Chiusura centralizzata"
    ],
    "specs_it": {
      "Marca": "Renault",
      "Modello": "Kadjar",
      "Allestimento": "Experience",
      "Anno": 2015,
      "Prima immatricolazione": "12/2015",
      "Chilometraggio": "74.000 km",
      "Alimentazione": "Benzina",
      "Cambio": "Manuale",
      "Potenza": "96 kW (131 CV)",
      "Carrozzeria": "SUV/Fuoristrada/Pickup",
      "Porte": 5,
      "Posti": 5,
      "Colore": "Bianco metallizzato",
      "Interni": "Tessuto, Nero",
      "Classe emissioni": "Euro6",
      "Emissioni CO2": "133.0 g/km"
    }
  },
  "price": {
    "listed_eur": 9750.0,
    "final_eur": 13042,
    "final_title": "Renault Kadjar Experience 13.042 €",
    "breakdown": {
      "listed_eur": 9750.0,
      "surcharge_pct": 3.0,
      "surcharge_eur": 292.5,
      "fixed_1_eur": 1500.0,
      "fixed_2_eur": 1500.0,
      "final_eur": 13042
    }
  }
}