{
  "source_url": "https://suchen.mobile.de/fahrzeuge/details.html?id=459563767&dam=false&ms=19000%3B%3B%3B&od=up&ref=seo&s=Car&sb=rel&vc=Car",
  "source_id": "459563767",
  "make": "Opel",
  "model": "Insignia",
  "variant": "Dynamic",
  "generated_at": "2026-07-13T13:06:21+00:00",
  "_meta": {
    "text_by": "op-translator-copy (Gael)",
    "price_by": "op-pricer (Max)"
  },
  "content": {
    "title_it": "Opel Insignia Dynamic",
    "headline_it": "2017 · 72.595 km · Benzina",
    "description_it": "Opel Insignia Dynamic in ottime condizioni, disponibile presso la nostra concessionaria. Vettura immatricolata nel 2017, con 72.595 km, alimentazione benzina, cambio manuale, potenza di 165 CV. Tra le dotazioni: Vetri oscurati, ABS, Cruise control adattivo, Avviso distanza di sicurezza, Bracciolo, sistema di assistenza alla guida in retromarcia, Volante riscaldato e Assistente partenza in salita. Possibilità di permuta e finanziamento. Contattaci per una prova o maggiori informazioni.",
    "highlights_it": [
      "Immatricolata 2017",
      "72.595 km",
      "Cambio manuale",
      "Alimentazione benzina",
      "165 CV",
      "Cruise control adattivo"
    ],
    "equipment_it": [
      "Vetri oscurati",
      "ABS",
      "Cruise control adattivo",
      "Avviso distanza di sicurezza",
      "Bracciolo",
      "sistema di assistenza alla guida in retromarcia",
      "Volante riscaldato",
      "Assistente partenza in salita",
      "Bluetooth",
      "Computer di bordo",
      "Alzacristalli elettrici",
      "Specchietti laterali elettrici",
      "specchietti laterali elettrici anklappbar",
      "Elettrico. Sedile regolazione",
      "Elettrico. regolazione sedili con memoria-Funktion",
      "Immobilizzatore elettronico",
      "ESP",
      "Assistente abbaglianti",
      "Vivavoce",
      "Trazione anteriore",
      "Garanzia",
      "separatore del vano bagagli",
      "Limitatore di velocità",
      "Head-Up Display",
      "Specchietto interno autoschermante",
      "Attacchi Isofix",
      "Fari adattivi in curva",
      "Volante in pelle",
      "Fari LED",
      "Luci diurne LED",
      "Cerchi in lega",
      "Sensore luci",
      "Supporto lombare",
      "Sedili con massaggio",
      "Volante multifunzione",
      "Navigatore",
      "Fendinebbia",
      "Veicolo non fumatori",
      "Assistente frenata di emergenza",
      "Sistema di chiamata d'emergenza",
      "Sensore pioggia",
      "Controllo pressione pneumatici",
      "chiusura centralizzata senza chiave (Keyless)",
      "Servosterzo",
      "Sedili ventilati",
      "Sedili riscaldati",
      "Skisack",
      "Pneumatici estivi",
      "Impianto audio premium",
      "Sedili sportivi",
      "Comandi vocali",
      "Assistente mantenimento corsia",
      "Sistema start&stop",
      "Assistente angolo cieco",
      "Touchscreen",
      "Controllo di trazione",
      "Tuner/Radio",
      "USB",
      "Riconoscimento segnali stradali",
      "Chiusura centralizzata"
    ],
    "specs_it": {
      "Marca": "Opel",
      "Modello": "Insignia",
      "Allestimento": "Dynamic",
      "Anno": 2017,
      "Prima immatricolazione": "08/2017",
      "Chilometraggio": "72.595 km",
      "Alimentazione": "Benzina",
      "Cambio": "Manuale",
      "Potenza": "121 kW (165 CV)",
      "Carrozzeria": "Berlina",
      "Porte": 5,
      "Posti": 5,
      "Colore": "Nero Metallizzato",
      "Interni": "Completo pelle, Nero",
      "Classe emissioni": "Euro6",
      "Emissioni CO2": "136.0 g/km"
    }
  },
  "price": {
    "listed_eur": 15950.0,
    "final_eur": 19428,
    "final_title": "Opel Insignia Dynamic 19.428 €",
    "breakdown": {
      "listed_eur": 15950.0,
      "surcharge_pct": 3.0,
      "surcharge_eur": 478.5,
      "fixed_1_eur": 1500.0,
      "fixed_2_eur": 1500.0,
      "final_eur": 19428
    }
  }
}