{
  "source_url": "https://suchen.mobile.de/fahrzeuge/details.html?id=453268294&dam=false&ms=24100%3B%3B%3B&od=up&ref=seo&refId=b7ffbaf8-657c-1b8e-8812-3dc63d98ce5b&s=Car&sb=rel&searchId=b7ffbaf8-657c-1b8e-8812-3dc63d98ce5b&vc=Car",
  "source_id": "453268294",
  "make": "Toyota",
  "model": "C-HR",
  "variant": "Flow",
  "generated_at": "2026-07-09T08:12:14+00:00",
  "_meta": {
    "text_by": "op-translator-copy (Gael)",
    "price_by": "op-pricer (Max)"
  },
  "content": {
    "title_it": "Toyota C-HR Flow",
    "headline_it": "2018 · 86.500 km · Benzina",
    "description_it": "Toyota C-HR Flow in ottime condizioni, disponibile presso la nostra concessionaria. Vettura immatricolata nel 2018, con 86.500 km, alimentazione benzina, cambio manuale, potenza di 116 CV. Tra le dotazioni: ABS, Cruise control adattivo, Avviso distanza di sicurezza, Assistente partenza in salita, Bluetooth, Computer di bordo, Alzacristalli elettrici e Specchietti laterali elettrici. Possibilità di permuta e finanziamento. Contattaci per una prova o maggiori informazioni.",
    "highlights_it": [
      "Immatricolata 2018",
      "86.500 km",
      "Cambio manuale",
      "Alimentazione benzina",
      "116 CV",
      "Cruise control adattivo"
    ],
    "equipment_it": [
      "ABS",
      "Cruise control adattivo",
      "Avviso distanza di sicurezza",
      "Assistente partenza in salita",
      "Bluetooth",
      "Computer di bordo",
      "Alzacristalli elettrici",
      "Specchietti laterali elettrici",
      "Immobilizzatore elettronico",
      "ESP",
      "Assistente abbaglianti",
      "Vivavoce",
      "Trazione anteriore",
      "Garanzia",
      "separazione vano bagagli",
      "Limitatore di velocità",
      "ispezione nuova",
      "Attacchi Isofix",
      "Volante in pelle",
      "Cerchi in lega",
      "Sensore luci",
      "Supporto lombare",
      "Volante multifunzione",
      "Predisposizione navigatore",
      "Fendinebbia",
      "Veicolo non fumatori",
      "Assistente frenata di emergenza",
      "Kit riparazione pneumatici",
      "Radio DAB",
      "Sensore pioggia",
      "Controllo pressione pneumatici",
      "Tagliandi regolari certificati",
      "chiusura centralizzata senza chiave (Keyless)",
      "Servosterzo",
      "Sedili riscaldati",
      "Pneumatici estivi",
      "Impianto audio premium",
      "Assistente mantenimento corsia",
      "Sistema start&stop",
      "Luci diurne",
      "Assistente angolo cieco",
      "Controllo di trazione",
      "Tuner/Radio",
      "USB",
      "Riconoscimento segnali stradali",
      "Chiusura centralizzata"
    ],
    "specs_it": {
      "Marca": "Toyota",
      "Modello": "C-HR",
      "Allestimento": "Flow",
      "Anno": 2018,
      "Prima immatricolazione": "04/2018",
      "Chilometraggio": "86.500 km",
      "Alimentazione": "Benzina",
      "Cambio": "Manuale",
      "Potenza": "85 kW (116 CV)",
      "Carrozzeria": "SUV/Fuoristrada/Pickup",
      "Porte": 5,
      "Posti": 5,
      "Colore": "Grigio metallizzato",
      "Interni": "Andere, Andere",
      "Emissioni CO2": "136.0 g/km"
    }
  },
  "price": {
    "listed_eur": 16590.0,
    "final_eur": 20088,
    "final_title": "Toyota C-HR Flow 20.088 €",
    "breakdown": {
      "listed_eur": 16590.0,
      "surcharge_pct": 3.0,
      "surcharge_eur": 497.7,
      "fixed_1_eur": 1500.0,
      "fixed_2_eur": 1500.0,
      "final_eur": 20088
    }
  }
}