{
  "source_url": "https://suchen.mobile.de/auto-inserat/mercedes-benz-c-200-d-avantgarde-navi-led-park-paket-kamera-sh-dietzenbach-bei-frankfurt/448941376.html?lst=p",
  "source_id": "448941376",
  "make": "Mercedes-Benz",
  "model": "C 200",
  "variant": "Avantgarde",
  "generated_at": "2026-07-03T15:50:51+00:00",
  "_meta": {
    "text_by": "op-translator-copy (Gael)",
    "price_by": "op-pricer (Max)"
  },
  "content": {
    "title_it": "Mercedes-Benz C 200 Avantgarde",
    "headline_it": "2024 · 29.561 km · Diesel",
    "description_it": "Mercedes-Benz C 200 Avantgarde in ottime condizioni, disponibile presso la nostra concessionaria. Vettura immatricolata nel 2024, con 29.561 km, alimentazione diesel, cambio automatico, potenza di 163 CV. Tra le dotazioni: ABS, Illuminazione d'ambiente, Android Auto, Apple CarPlay, Bracciolo, Volante riscaldato, Assistente partenza in salita e Bluetooth. Possibilità di permuta e finanziamento. Contattaci per una prova o maggiori informazioni.",
    "highlights_it": [
      "Immatricolata 2024",
      "29.561 km",
      "Cambio automatico",
      "Alimentazione diesel",
      "163 CV",
      "Barre sul tetto"
    ],
    "equipment_it": [
      "ABS",
      "Illuminazione d'ambiente",
      "Android Auto",
      "Apple CarPlay",
      "Bracciolo",
      "Volante riscaldato",
      "Assistente partenza in salita",
      "Bluetooth",
      "Computer di bordo",
      "Barre sul tetto",
      "Alzacristalli elettrici",
      "Portellone elettrico",
      "Elettrico. regolazione sedili",
      "Elettrico. regolazione sedili, posteriore",
      "Immobilizzatore elettronico",
      "ESP",
      "Assistente abbaglianti",
      "Vivavoce",
      "Garanzia",
      "Limitatore di velocità",
      "Trazione posteriore",
      "Ricarica wireless per smartphone",
      "Attacchi Isofix",
      "Volante in pelle",
      "Fari LED",
      "Luci diurne LED",
      "Cerchi in lega",
      "Sensore luci",
      "Rilevatore di stanchezza",
      "Volante multifunzione",
      "Navigatore",
      "Veicolo non fumatori",
      "Assistente frenata di emergenza",
      "Sistema di chiamata d'emergenza",
      "Kit riparazione pneumatici",
      "Filtro antiparticolato",
      "Radio DAB",
      "Sensore pioggia",
      "Controllo pressione pneumatici",
      "Tagliandi regolari certificati",
      "Servosterzo",
      "Sedili riscaldati",
      "Comandi vocali",
      "Assistente mantenimento corsia",
      "Sistema start&stop",
      "Cruise control",
      "Touchscreen",
      "Controllo di trazione",
      "Tuner/Radio",
      "USB",
      "Quadro strumenti digitale",
      "Pacchetto invernale",
      "Chiusura centralizzata"
    ],
    "specs_it": {
      "Marca": "Mercedes-Benz",
      "Modello": "C 200",
      "Allestimento": "Avantgarde",
      "Anno": 2024,
      "Prima immatricolazione": "11/2024",
      "Chilometraggio": "29.561 km",
      "Alimentazione": "Diesel",
      "Cambio": "Automatico",
      "Potenza": "120 kW (163 CV)",
      "Carrozzeria": "Station Wagon",
      "Porte": 5,
      "Posti": 5,
      "Colore": "Nero",
      "Interni": "Pelle e tessuto, Nero",
      "Classe emissioni": "Euro6",
      "Emissioni CO2": "139.0 g/km"
    }
  },
  "price": {
    "listed_eur": 27935.0,
    "final_eur": 31773,
    "final_title": "Mercedes-Benz C 200 Avantgarde 31.773 €",
    "breakdown": {
      "listed_eur": 27935.0,
      "surcharge_pct": 3.0,
      "surcharge_eur": 838.05,
      "fixed_1_eur": 1500.0,
      "fixed_2_eur": 1500.0,
      "final_eur": 31773
    }
  }
}