{
  "source_url": "https://m.mobile.de/auto-inserat/mercedes-benz-cla-200-shooting-brake-automat-pano-nav-led-dist-mannheim/459633015.html?ref=seo&refId=cb916ebb-4bd0-784a-078c-f098936d186c&searchId=cb916ebb-4bd0-784a-078c-f098936d186c&type=ad",
  "source_id": "459633015",
  "make": "Mercedes-Benz",
  "model": "CLA 200 Shooting Brake",
  "variant": "CLA 200 SHOOTING BRAKE AUTOMAT+PANO+NAV+LED+DIST",
  "generated_at": "2026-07-05T09:13:48+00:00",
  "_meta": {
    "text_by": "op-translator-copy (Gael)",
    "price_by": "op-pricer (Max)"
  },
  "content": {
    "title_it": "Mercedes-Benz CLA 200 Shooting Brake CLA 200 SHOOTING BRAKE AUTOMAT+PANO+NAV+LED+DIST",
    "headline_it": "2016 · 84.800 km · Benzina",
    "description_it": "Mercedes-Benz CLA 200 Shooting Brake CLA 200 SHOOTING BRAKE AUTOMAT+PANO+NAV+LED+DIST in ottime condizioni, disponibile presso la nostra concessionaria. Vettura immatricolata nel 2016, con 84.800 km, alimentazione benzina, cambio automatico, potenza di 156 CV. Tra le dotazioni: ABS, Cruise control adattivo, Avviso distanza di sicurezza, Illuminazione d'ambiente, Gancio traino estraibile, Bracciolo, Assistente partenza in salita e Bluetooth. Possibilità di permuta e finanziamento. Contattaci per una prova o maggiori informazioni.",
    "highlights_it": [
      "Immatricolata 2016",
      "84.800 km",
      "Cambio automatico",
      "Alimentazione benzina",
      "156 CV",
      "Cruise control adattivo"
    ],
    "equipment_it": [
      "ABS",
      "Cruise control adattivo",
      "Avviso distanza di sicurezza",
      "Illuminazione d'ambiente",
      "Gancio traino estraibile",
      "Bracciolo",
      "Assistente partenza in salita",
      "Bluetooth",
      "Computer di bordo",
      "CD-Spieler",
      "Alzacristalli elettrici",
      "Portellone elettrico",
      "Specchietti laterali elettrici",
      "specchietti laterali elettrici anklappbar",
      "Immobilizzatore elettronico",
      "ESP",
      "Vivavoce",
      "Trazione anteriore",
      "Garanzia",
      "Separazione vano bagagli",
      "Limitatore di velocità",
      "Specchietto interno autoschermante",
      "Attacchi Isofix",
      "Volante in pelle",
      "Fari LED",
      "Luci diurne LED",
      "Cerchi in lega",
      "Sensore luci",
      "Supporto lombare",
      "Rilevatore di stanchezza",
      "Volante multifunzione",
      "Streaming musicale integrato",
      "Navigatore",
      "Veicolo non fumatori",
      "Assistente frenata di emergenza",
      "Sistema di chiamata d'emergenza",
      "Kit riparazione pneumatici",
      "Tetto panoramico",
      "Sensore pioggia",
      "Controllo pressione pneumatici",
      "Palette al volante",
      "Tagliandi regolari certificati",
      "Servosterzo",
      "Sedili riscaldati",
      "Impianto audio premium",
      "Pacchetto sportivo",
      "Sedili sportivi",
      "Comandi vocali",
      "Sistema start&stop",
      "Controllo di trazione",
      "Tuner/Radio",
      "USB",
      "Pacchetto invernale",
      "Chiusura centralizzata"
    ],
    "specs_it": {
      "Marca": "Mercedes-Benz",
      "Modello": "CLA 200 Shooting Brake",
      "Allestimento": "CLA 200 SHOOTING BRAKE AUTOMAT+PANO+NAV+LED+DIST",
      "Anno": 2016,
      "Prima immatricolazione": "09/2016",
      "Chilometraggio": "84.800 km",
      "Alimentazione": "Benzina",
      "Cambio": "Automatico",
      "Potenza": "115 kW (156 CV)",
      "Carrozzeria": "Station Wagon",
      "Porte": 5,
      "Posti": 5,
      "Colore": "Rosso",
      "Interni": "Vollleder, Nero",
      "Classe emissioni": "Euro6"
    }
  },
  "price": {
    "listed_eur": 18680.0,
    "final_eur": 22240,
    "final_title": "Mercedes-Benz CLA 200 Shooting Brake CLA 200 SHOOTING BRAKE AUTOMAT+PANO+NAV+LED+DIST 22.240 €",
    "breakdown": {
      "listed_eur": 18680.0,
      "surcharge_pct": 3.0,
      "surcharge_eur": 560.4,
      "fixed_1_eur": 1500.0,
      "fixed_2_eur": 1500.0,
      "final_eur": 22240
    }
  }
}